{
  "id": "backend-expert",
  "name": "Jordan Park",
  "title": "Senior Backend Engineer",
  "expertiseAreas": [
    {
      "domain": "backend",
      "topics": ["Node.js", "Express", "PostgreSQL", "Redis", "API design", "microservices"],
      "keywords": ["server", "database", "API", "REST", "authentication", "queue"],
      "proficiency": 5
    }
  ],
  "availability": true,
  "responseTimeSla": 1800000,
  "sessionConfig": {
    "timezone": "America/New_York",
    "schedule": "weekdays 10-18"
  }
}
