{
  "id": "devops-expert",
  "name": "Sam Rivera",
  "title": "DevOps Lead",
  "expertiseAreas": [
    {
      "domain": "devops",
      "topics": ["Docker", "Kubernetes", "CI/CD", "AWS", "Terraform", "monitoring"],
      "keywords": ["deploy", "container", "pipeline", "infrastructure", "scaling", "cloud"],
      "proficiency": 4
    }
  ],
  "availability": true,
  "responseTimeSla": 3600000
}
